<?xml version="1.0" encoding="UTF-8"?>
<xs:schema attributeFormDefault="unqualified" elementFormDefault="qualified" xmlns:xs="http://www.w3.org/2001/XMLSchema">
  <xs:element name="jornada" type="jornadaType"/>
  <xs:complexType name="PartidoType">
    <xs:sequence>
      <xs:element name="HORA" type="xs:string"/>
      <xs:element name="GOLES_EQ1" type="xs:string"/>
      <xs:element name="GOLES_EQ2" type="xs:string"/>
      <xs:element name="ID_Ganador" type="xs:string"/>
    </xs:sequence>
    <xs:attribute type="xs:string" name="ID_PARTIDO" use="optional"/>
  </xs:complexType>
  <xs:complexType name="jornadaType">
    <xs:sequence>
      <xs:element type="xs:string" name="ID_JOR"/>
      <xs:element type="xs:string" name="ID_TEMP"/>
      <xs:element type="xs:string" name="Dia"/>
      <xs:element type="xs:string" name="TIPO"/>
      <xs:element type="PartidoType" name="Partido" maxOccurs="unbounded" minOccurs="0"/>
    </xs:sequence>
    <xs:attribute type="xs:string" name="NUMERO"/>
  </xs:complexType>
</xs:schema>
