<?xml version="1.0" encoding="UTF-8"?>
<!DOCTYPE jornada SYSTEM "ultimajornada.dtd">
<jornada NUMERO="1" xmlns:xsi="http://www.w3.org/2001/XMLSchema-instance"
               xsi:noNamespaceSchemaLocation="ultimajornada.xsd">
    <ID_JOR>1</ID_JOR>
    <ID_TEMP>1</ID_TEMP>
    <Dia>01/01/2024</Dia>
    <TIPO>FaseRegular</TIPO>
       <Partido ID_PARTIDO="1">       
            <HORA>16:00</HORA>
            <GOLES_EQ1>3</GOLES_EQ1>
            <GOLES_EQ2>4</GOLES_EQ2>
            <ID_Ganador>5</ID_Ganador>
       </Partido> 
       
       <Partido ID_PARTIDO="2">       
            <HORA>17:00</HORA>
            <GOLES_EQ1>4</GOLES_EQ1>
            <GOLES_EQ2>2</GOLES_EQ2>
            <ID_Ganador>2</ID_Ganador>
       </Partido> 
       
       <Partido ID_PARTIDO="3">       
            <HORA>18:00</HORA>
            <GOLES_EQ1>3</GOLES_EQ1>
            <GOLES_EQ2>6</GOLES_EQ2>
            <ID_Ganador>10</ID_Ganador>
       </Partido> 
       
       <Partido ID_PARTIDO="4">       
            <HORA>19:00</HORA>
            <GOLES_EQ1>1</GOLES_EQ1>
            <GOLES_EQ2>5</GOLES_EQ2>
            <ID_Ganador>12</ID_Ganador>
       </Partido> 
       
       <Partido ID_PARTIDO="5">       
            <HORA>20:00</HORA>
            <GOLES_EQ1>5</GOLES_EQ1>
            <GOLES_EQ2>3</GOLES_EQ2>
            <ID_Ganador>7</ID_Ganador>
       </Partido> 
       
       <Partido ID_PARTIDO="6">       
            <HORA>21:00</HORA>
            <GOLES_EQ1>3</GOLES_EQ1>
            <GOLES_EQ2>5</GOLES_EQ2>
            <ID_Ganador>1</ID_Ganador>
       </Partido> 
  </jornada>
  